{
  "concept_id": "conversions",
  "name_cn": "转化数",
  "name_en": "Conversions",
  "layer": "L3",
  "tier": "base",
  "caliber": "platform",
  "definition": "广告带来的转化次数，通常来自平台报表中的 conversions 字段，是计算 CVR、ROAS 等指标的基础数据。",
  "formula": null,
  "unit": "count",
  "source": "Amazon Ads spend report / 平台广告转化数据",
  "source_field": "conversions",
  "value_range": [0, null],
  "baseline": { "type": "account_mean", "value": null },
  "threshold": null,
  "granularity": {
    "time": "daily",
    "entity": "campaign",
    "aggregation": "sum",
    "requires_full_batch": false
  },
  "dimensions": ["campaign"],
  "related_concepts": [
    { "target": "cvr", "relation": "input_to", "strength": "strong" },
    { "target": "roas", "relation": "input_to", "strength": "strong" },
    { "target": "acos", "relation": "input_to", "strength": "strong" }
  ]
}
