{
  "concept_id": "attribution_divergence",
  "name_cn": "归因差异度",
  "name_en": "Attribution Divergence",
  "layer": "L5",
  "tier": "mta",
  "caliber": "mta",
  "definition": "衡量同一触点、同一 outcome 在 Markov 与 Shapley 下的绝对份额差异。上游 gap_pp 的单位是百分点，本概念换算为 ratio；它只描述触点级模型分歧，不得跨实体粒度使用，也不代表因果有效性。报告窗口从同批次模型比较汇总或来源快照继承。",
  "formula": "gap_pp / 100",
  "unit": "ratio",
  "source": "MTA amc_mta_model_comparison_touchpoints.csv",
  "source_field": "gap_pp",
  "value_type": "number",
  "value_range": [0, 1],
  "baseline": { "type": "historical_diff_mean", "value": null },
  "threshold": null,
  "granularity": {
    "time": "snapshot",
    "entity": "touchpoint",
    "aggregation": "compare",
    "requires_full_batch": true
  },
  "dimensions": ["report_window", "touchpoint", "outcome"],
  "related_concepts": [
    { "target": "contribution_share", "relation": "compared_with", "strength": "strong" }
  ]
}
